"","termID","termName","termDesc","unitName","dataType","relatedTerms"
"2510",1680,"wellDischargeRate","Rate at which  water is removed from well during sampling","millilitersPerMinute","real",NA
"2511",1681,"wellVolumePurged","Total volume removed from the well, prior to sampling","liter","real",NA
"2512",1682,"wellSampleDepth","Depth at which groundwater sample was collected. Depth measured from top of well casing","meter","real",NA
"2513",1683,"time","The time or interval during which an event occurred","NA","dateTime",NA
"2514",1684,"groundwaterTempExpUncert","Expanded uncertainty for temperature of groundwater in degrees celsius","celsius","real",NA
"2515",1685,"groundwaterTempRangeQF","Temperature of groundwater quality flag for the range test, detailed in NEON.DOC.011081 (1=fail, 0=pass, -1=NA (i.e., could not be run))","NA","signed integer",NA
"2516",1686,"groundwaterTempPersistenceQF","Temperature of groundwater quality flag for the persistence test, detailed in NEON.DOC.011081 (1=fail, 0=pass, -1=NA (i.e., could not be run))","NA","signed integer",NA
"2517",1687,"groundwaterTempStepQF","Temperature of groundwater quality flag for the step test, detailed in NEON.DOC.011081 (1=fail, 0=pass, -1=NA (i.e., could not be run))","NA","signed integer",NA
"2518",1688,"groundwaterTempNullQF","Temperature of groundwater quality flag for the null test, detailed in NEON.DOC.011081 (1=fail, 0=pass, -1=NA (i.e., could not be run))","NA","signed integer",NA
"2519",1689,"groundwaterTempGapQF","Temperature of groundwater quality flag for the gap test, detailed in NEON.DOC.011081 (1=fail, 0=pass, -1=NA (i.e., could not be run))","NA","signed integer",NA
"2520",1690,"groundwaterTempConsistencyQF","Temperature of groundwater quality flag for the consistency test, detailed in NEON.DOC.011081 (1=fail, 0=pass, -1=NA (i.e., could not be run))","NA","signed integer",NA
"2521",1691,"groundwaterTempSpikeQF","Temperature of groundwater quality flag for the spike test, detailed in NEON.DOC.011081 (1=fail, 0=pass, -1=NA (i.e., could not be run))","NA","signed integer",NA
"2522",1692,"groundwaterTempMean","Arithmetic mean of temperature of groundwater in degrees celsius","celsius","real",NA
"2523",1693,"groundwaterTempMinimum","Minimum temperature of groundwater in degrees celsius","celsius","real",NA
"2524",1694,"groundwaterTempMaximum","Maximum temperature of groundwater in degrees celsius","celsius","real",NA
"2525",1695,"groundwaterTempVariance","Variance in temperature of groundwater in degrees celsius","celsiusSquared","real",NA
"2526",1696,"groundwaterTempNumPts","Number of points used to calculate the arithmetic mean of temperature of groundwater in degrees celsius","number","real",NA
"2527",1697,"groundwaterTempStdErMean","Standard error of the mean for temperature of groundwater in degrees celsius","celsius","real",NA
"2528",1698,"groundwaterSpecCond","Specific conductivity in groundwater in microsiemens per centimeter","microsiemensPerCentimeter","real",NA
"2529",1699,"groundwaterSpecCondExpUncert","Expanded uncertainty for Specific Conductivity in groundwater in degrees celsius","microsiemensPerCentimeter","real",NA
"2530",1700,"groundwaterSpecCondRangeQF","Specific Conductivity in groundwater quality flag for the range test, detailed in NEON.DOC.011081 (1=fail, 0=pass, -1=NA (i.e., could not be run))","NA","signed integer",NA
"2531",1701,"groundwaterSpecCondPersistQF","Specific Conductivity in groundwater quality flag for the persistence test, detailed in NEON.DOC.011081 (1=fail, 0=pass, -1=NA (i.e., could not be run))","NA","signed integer",NA
"2532",1702,"groundwaterSpecCondStepQF","Specific Conductivity in groundwater quality flag for the step test, detailed in NEON.DOC.011081 (1=fail, 0=pass, -1=NA (i.e., could not be run))","NA","signed integer",NA
"2533",1703,"groundwaterSpecCondNullQF","Specific Conductivity in groundwater quality flag for the null test, detailed in NEON.DOC.011081 (1=fail, 0=pass, -1=NA (i.e., could not be run))","NA","signed integer",NA
"2534",1704,"groundwaterSpecCondGapQF","Specific Conductivity in groundwater quality flag for the gap test, detailed in NEON.DOC.011081 (1=fail, 0=pass, -1=NA (i.e., could not be run))","NA","signed integer",NA
"2535",1705,"groundwaterSpecCondConsistQF","Specific Conductivity in groundwater quality flag for the consistency test, detailed in NEON.DOC.011081 (1=fail, 0=pass, -1=NA (i.e., could not be run))","NA","signed integer",NA
"2536",1706,"groundwaterSpecCondSpikeQF","Specific Conductivity in groundwater quality flag for the spike test, detailed in NEON.DOC.011081 (1=fail, 0=pass, -1=NA (i.e., could not be run))","NA","signed integer",NA
"2537",1707,"groundwaterSpecCondMean","Arithmetic mean of Specific Conductivity in groundwater in degrees celsius","microsiemensPerCentimeter","real",NA
"2538",1708,"groundwaterSpecCondMinimum","Minimum Specific Conductivity in groundwater in degrees celsius","microsiemensPerCentimeter","real",NA
"2539",1709,"groundwaterSpecCondMaximum","Maximum Specific Conductivity in groundwater in degrees celsius","microsiemensPerCentimeter","real",NA
"2540",1710,"groundwaterSpecCondVariance","Variance in Specific Conductivity in groundwater in degrees celsius","microsiemensPerCentimeterSquared","real",NA
"2541",1711,"groundwaterSpecCondNumPts","Number of points used to calculate the arithmetic mean of Specific Conductivity in groundwater in degrees celsius","number","real",NA
"2542",1712,"groundwaterSpecCondStdErMean","Standard error of the mean for Specific Conductivity in groundwater in degrees celsius","microsiemensPerCentimeter","real",NA
"2543",1713,"groundwaterElev","Elevation of groundwater","meter","real",NA
"2544",1714,"groundwaterElevExpUncert","Expanded uncertainty for elevation of groundwater","meter","real",NA
"2545",1715,"groundwaterElevRangeQF","Elevation of groundwater quality flag for the range test, detailed in NEON.DOC.011081 (1=fail, 0=pass, -1=NA (i.e., could not be run))","NA","signed integer",NA
"2546",1716,"groundwaterElevPersistQF","Elevation of groundwater quality flag for the persistence test, detailed in NEON.DOC.011081 (1=fail, 0=pass, -1=NA (i.e., could not be run))","NA","signed integer",NA
"2547",1717,"groundwaterElevStepQF","Elevation of groundwater quality flag for the step test, detailed in NEON.DOC.011081 (1=fail, 0=pass, -1=NA (i.e., could not be run))","NA","signed integer",NA
"2548",1718,"groundwaterElevNullQF","Elevation of groundwater quality flag for the null test, detailed in NEON.DOC.011081 (1=fail, 0=pass, -1=NA (i.e., could not be run))","NA","signed integer",NA
"2549",1719,"groundwaterElevGapQF","Elevation of groundwater quality flag for the gap test, detailed in NEON.DOC.011081 (1=fail, 0=pass, -1=NA (i.e., could not be run))","NA","signed integer",NA
"2550",1720,"groundwaterElevConsistQF","Elevation of groundwater quality flag for the consistency test, detailed in NEON.DOC.011081 (1=fail, 0=pass, -1=NA (i.e., could not be run))","NA","signed integer",NA
"2551",1721,"groundwaterElevSpikeQF","Elevation of groundwater quality flag for the spike test, detailed in NEON.DOC.011081 (1=fail, 0=pass, -1=NA (i.e., could not be run))","NA","signed integer",NA
"2552",1722,"groundwaterElevMean","Arithmetic mean of elevation of groundwater","meter","real",NA
"2553",1723,"groundwaterElevMinimum","Minimum elevation of groundwater","meter","real",NA
"2554",1724,"groundwaterElevMaximum","Maximum elevation of groundwater","meter","real",NA
"2555",1725,"groundwaterElevVariance","Variance in elevation of groundwater","metersSquared","real",NA
"2556",1726,"groundwaterElevNumPts","Number of points used to calculate the arithmetic mean of elevation of groundwater","number","real",NA
"2557",1727,"groundwaterElevStdErMean","Standard error of the mean for elevation of groundwater","meter","real",NA
"2558",1728,"soilPRTResistance","Resistance of soil deployed Platinum Resistance Thermometer (PRT) at temperature T","ohm","real",NA
"2559",1729,"rawCO2","Raw CO2 concentration prior to application of the calibration or temperature, pressure, oxygen, and humidity compensations","partsPerMillion","real",NA
"2560",1730,"headspaceTemp","Temperature in the sensor headspace","celsius","real",NA
"2561",1731,"errorStatus","Error status of the sensor","NA","real",NA
"2562",1732,"trapType","Type of trap from which a sample was collected","NA","string",NA
"2563",1733,"externalConductance","Specific conductivity (auto-corrected to 25 degrees C) measured at the external lab","microsiemensPerCentimeter","real",NA
"2564",1734,"waterCarbonate","Carbonate concentration","milligramsPerLiter","real",NA
"2565",1735,"waterBicarbonate","Bicarbonate concentration","milligramsPerLiter","real",NA
"2566",1736,"externalANC","Acid neutralizing capacity titration result from external lab in milligrams of Calcium Carbonate per liter","milliequivalentsPerLiter","real",NA
"2567",1737,"waterCalcium","Calcium concentration","milligramsPerLiter","real",NA
"2568",1738,"waterMagnesium","Magnesium concentration","milligramsPerLiter","real",NA
"2569",1739,"waterSodium","Sodium concentration","milligramsPerLiter","real",NA
"2570",1740,"waterPotassium","Potassium concentration","milligramsPerLiter","real",NA
"2571",1741,"waterSulfate","Sulfate concentration","milligramsPerLiter","real",NA
"2572",1742,"waterChlorine","Chlorine concentration","milligramsPerLiter","real",NA
"2573",1743,"waterManganese","Manganese concentration","milligramsPerLiter","real",NA
"2574",1744,"waterIron","Iron concentration","milligramsPerLiter","real",NA
"2575",1745,"waterBromine","Bromine concentration","milligramsPerLiter","real",NA
"2576",1746,"waterFluorine","Fluorine concentration","milligramsPerLiter","real",NA
"2577",1747,"waterSilica","Silica concentration","milligramsPerLiter","real",NA
"2578",1748,"totalSuspendedSolids","Total suspended solids concentration","milligramsPerLiter","real",NA
"2579",1749,"totalSuspendedSolidsDryMass","Dry mass of total suspended solids","microgram","real",NA
"2580",1750,"totalDissolvedSolids","Total dissolved solids concentration","milligramsPerLiter","real",NA
"2581",1751,"waterNitrateAndNitriteN","Nitrate plus nitrite concentration as milligrams Nitrogen per liter","milligramsPerLiter","real",NA
"2582",1752,"waterNitriteN","Nitrite concentration concentration as milligrams Nitrogen per liter","milligramsPerLiter","real",NA
"2583",1753,"waterAmmoniumN","Ammonium concentration as milligrams Nitrogen per liter","milligramsPerLiter","real",NA
"2584",1754,"waterOrthophosphateP","Orthophosphate concentration as milligrams Phosphorus per liter","milligramsPerLiter","real",NA
"2585",1755,"waterTotalNitrogen","Total nitrogen concentration","milligramsPerLiter","real",NA
"2586",1756,"totalDissolvedNitrogen","Total dissolved nitrogen concentration","milligramsPerLiter","real",NA
"2587",1757,"dissolvedInorganicCarbon","Dissolved inorganic carbon concentration","milligramsPerLiter","real",NA
"2588",1758,"dissolvedOrganicCarbon","Dissolved organic carbon concentration","milligramsPerLiter","real",NA
"2589",1759,"waterTotalOrganicCarbon","Total organic carbon","milligramsPerLiter","real",NA
"2590",1760,"waterTotalPhosphorus","Total phosphorus","milligramsPerLiter","real",NA
"2591",1761,"totalDissolvedPhosphorus","Total dissolved phosphorus","milligramsPerLiter","real",NA
"2592",1762,"totalParticulateCarbonMass","Total particulate carbon as milligrams Carbon","milligram","real",NA
"2593",1763,"totalParticulateNitrogenMass","Total particulate nitrogen as milligrams Nitrogen","milligram","real",NA
"2594",1764,"uvAbsorbance250","Ultraviolet absorbance at 250nm reported per 1cm path length","NA","real",NA
"2595",1765,"uvAbsorbance284","Ultraviolet absorbance at 284nm reported per 1cm path length","NA","real",NA
"2596",1766,"nitrateNitriteRunID","a linking value provided by the external lab that associates the nitrate plus nitrite to the run metadata","NA","string",NA
"2597",1767,"nitriteRunID","a linking value provided by the external lab that associates the nitrite to the run metadata","NA","string",NA
"2598",1768,"nh4RunID","a linking value provided by the external lab that associates the ammonium to the run metadata","NA","string",NA
"2599",1769,"OrthoPRunID","a linking value provided by the external lab that associates the orthophosphates to the run metadata","NA","string",NA
"2600",1770,"tnRunID","a linking value provided by the external lab that associates the total nitrogen to the run metadata","NA","string",NA
"2601",1771,"tdnRunID","a linking value provided by the external lab that associates the total dissolved nitrogen to the run metadata","NA","string",NA
"2602",1772,"dicRunID","a linking value provided by the external lab that associates the dissolved inorganic carbon to the run metadata","NA","string",NA
"2603",1773,"docRunID","a linking value provided by the external lab that associates the dissolved organic carbon to the run metadata","NA","string",NA
"2604",1774,"tocRunID","a linking value provided by the external lab that associates the total organic carbon to the run metadata","NA","string",NA
"2605",1775,"tpcnRunDate","A linking value provided by the external lab that associates the total carbon or total nitrogen to run date","NA","dateTime",NA
"2606",1776,"tpcnVolume","Water volume used for total particulate carbon and nitrogen in milliliters","milliliter","real",NA
"2607",1777,"uvBatchID","a linking value provided by the external lab that associates the ultraviolet absorbance to the batch metadata","NA","string",NA
"2608",1778,"coolerTemp","Temperature of the cooler when the sample arrived at the external lab","celsius","real",NA
"2609",1779,"externalLabMetadata","The external lab's metadata","NA","string",NA
"2610",1780,"internalLabID","Internal identifier used by the external facility","NA","string",NA
"2611",1781,"shipmentReceivedDate","Date a sample was received","NA","dateTime",NA
"2612",1782,"receivedBy","Anonymized name of lab personnel receiving the shipment","NA","string",NA
"2613",1783,"shipDate","Date shipment sent by domain lab","NA","dateTime",NA
"2614",1784,"shipmentID","Unique identifier associated with shipment","NA","string",NA
"2615",1785,"shipmentCondition","The condition in which the shipment was received","NA","string",NA
"2616",1786,"waterCarbonNitrogenRatio","Carbon to nitrogen ratio, calculated as TOC/TN","NA","real",NA
"2617",1787,"shipmentWarmQF","Quality Flag for cooler arriving at external lab too warm (above 6 C)","NA","real",NA
"2618",1788,"shipmentLateQF","Quality Flag for shipment arriving more than one day after shipment sent","NA","real",NA
"2619",1789,"belowDetectionQF","Quality Flag indicating that at least one of the parameters in this record is below the method detection limit","NA","real",NA
"2620",1790,"totalParticulateCarbon","total particulate carbon as milligrams Carbon per liter","milligramsPerLiter","real",NA
"2621",1791,"totalParticulateNitrogen","total particulate nitrogen as milligrams Nitrogen per liter","milligramsPerLiter","real",NA
"2622",1792,"externalRemarks","External lab notes; free text comments accompanying the record","NA","string",NA
"2623",1793,"externalDuplicateRecordQF","Quality Flag for duplicate record from external facility","NA","signed integer",NA
"2624",1794,"analytesBelowDetection","List of analytes that are below detection","NA","string",NA
"2625",1795,"idqQF","Quality Flag for identification qualifiers assigned at a different rank than taxonID","NA","signed integer",NA
"2626",1796,"rawIRImage","Image captured in the infrared spectrum","NA","binaryFile",NA
"2627",1797,"rawRGBImage","Image captured in the RGB color space","NA","binaryFile",NA
"2628",1798,"SHFVoltage","Soil heat flux sensor voltage	","volt","real",NA
"2629",1799,"SHFCalHeaterFlag","Calibration heater flag indicating whether the heater was operational to perform a self-calibration (0 = off, 1 = on)	","NA","real",NA
"2630",1800,"curVoltage","Voltage across the current sensing resistor	","volt","real",NA
"2631",1801,"uploadDate","Date the file was uploaded","NA","dateTime",NA
"2632",1802,"analyte","Analyte or parameter measured","NA","string",NA
"2633",1803,"instrument","Type of instrument used for the analysis","NA","string",NA
"2634",1804,"method","Published method used for analysis","NA","string","DWC_v2009-04-24:samplingProtocol [http://rs.tdwg.org/dwc/terms/history/index.htm#samplingProtocol-2009-04-24]"
"2635",1805,"methodModification","Any remarks on modifications to published methods","NA","string",NA
"2636",1806,"methodDetectionLimit","Detection limit for method used","NA","real",NA
"2637",1807,"analyteUnits","Associated units of measure for analyte","NA","string",NA
"2638",1808,"precision","Closeness of agreement between indications or measured quantity values obtained by replicate measurements on the same or similar objects under specified conditions","NA","real",NA
"2639",1809,"measurementUncertainty","Parameter, associated with the result of a measurement, that characterizes the dispersion of the values that could reasonably be attributed to the measurant","NA","real",NA
"2640",1810,"internalLabName","Name of internal laboratory or facility that is processing the sample","NA","string",NA
"2641",1811,"labSpecificStartDate","Date a specific analyte, instrument, and associated method detection limit combination started","NA","dateTime",NA
"2642",1812,"labSpecificEndDate","Date a specific analyte, instrument, and associated method detection limit combination ended","NA","dateTime",NA
"2643",1813,"rawSWCSalinity","Raw measurement of soil water content and index of salinity","NA","real",NA
"2644",1814,"baroPressParticulateMass","Barometric pressure measurements for proper pressure compensation to ensure constant flow rate	","millimetersOfMercury","real",NA
"2645",1815,"flowRate","Flow rate in cubic meters per hour","cubicMetersPerHour","real",NA
"2646",1816,"corrAirVolume","Accumulated sample air volume, corrected to standard conditions of temperature and pressure of 298 K (25 degrees C) and 101.3 kPa (760mm Hg)","cubicMeter","real",NA
"2647",1817,"uncorrAirVolume","Accumulated sample air volume, uncorrected ","cubicMeter","real",NA
"2648",1818,"chamberTemperature","Temperature of the wet deposition chamber","celsius","real",NA
"2649",1819,"powerStatus","Power status of the instrument (0=powered; 1=no power)","NA","real",NA
"2650",1820,"lidStatusWetDep","Lid status of the wet deposition collector (0=lid closed; 1=lid open)","NA","real",NA
"2651",1821,"rawWaterCalcium","Raw measurement of calcium concentration","milligramsPerLiter","real",NA
"2652",1822,"rawWaterMagnesium","Raw measurement of magnesium concentration","milligramsPerLiter","real",NA
"2653",1823,"rawWaterPotassium","Raw measurement of potassium concentration","milligramsPerLiter","real",NA
"2654",1824,"rawWaterSodium","Raw measurement of sodium concentration","milligramsPerLiter","real",NA
"2655",1825,"rawWaterAmmonium","Raw measurement of ammonium concentration","milligramsPerLiter","real",NA
"2656",1826,"rawWaterNitrate","Raw measurement of nitrate concentration","milligramsPerLiter","real",NA
"2657",1827,"rawWaterSulfate","Raw measurement of sulfate concentration","milligramsPerLiter","real",NA
"2658",1828,"rawWaterPhosphate","Raw measurement of phosphate concentration","milligramsPerLiter","real",NA
"2659",1829,"rawPH","Raw measurement of pH in water","pH","real",NA
"2660",1830,"rawConductance","Raw measurement of conductivity at ambient temperature","microsiemensPerCentimeter","real",NA
"2661",1831,"wetDepChemicalWeightField","Weight of the chemical constituent wet deposition sample as measured by NEON field technicians","gram","real",NA
"2662",1832,"wetDepChemicalWeightLab","Weight of the chemical constituent wet deposition sample as measured by the contracting laboratory	","gram","real",NA
"2663",1833,"rawOxygen18","Atmospheric oxygen 18 (isotope) as measured via wet deposition	","partsPerThousand","real",NA
"2664",1834,"rawDeuterium","Atmospheric deuterium as measured via wet deposition","partsPerThousand","real",NA
"2665",1835,"wetDepIsotopeWeightField","Weight of the chemical constituent wet deposition sample as measured by NEON field technicians	","gram","real",NA
"2666",1836,"wetDepIsotopeWeightLab","Weight of the isotopic wet deposition sample as measured by the contracting laboratory	","gram","real",NA
"2667",1837,"corPresTempQF","Corrected pressure quality flag that assesses whether temperature measurements for correcting pressure were available (0=yes, 1=no)","NA","unsigned integer",NA
"2668",1838,"corPresDewPtQF","Corrected pressure quality flag that assesses whether dew point measurements for correcting pressure were available (0=yes, 1=no)","NA","unsigned integer",NA
"2669",1839,"surfacePresTempQF","Surface pressure (soil plot surface for terrestrial and water surface for aquatic sites) quality flag that assesses whether temperature measurements for correcting pressure were available (0=yes, 1=no)","NA","real",NA
"2670",1840,"surfacePresDewPtQF","Surface pressure (soil plot surface for terrestrial and water surface for aquatic sites) quality flag that assesses whether dew point measurements for correcting pressure were available (0=yes, 1=no)","NA","real",NA
"2671",1841,"larvalTicksAttached","Indicates whether larval ticks are observed on the captured individual","NA","string",NA
"2672",1842,"nymphalTicksAttached","Indicates whether nymphal ticks are observed on the captured individual","NA","string",NA
"2673",1843,"adultTicksAttached","Indicates whether adult ticks are observed on the captured individual","NA","string",NA
"2674",1844,"individualNid","NEON unique identifier for an individual","NA","string",NA
"2675",1845,"setDateTime","Date and time of the trap setting event","NA","dateTime",NA
"2676",1846,"collectDateTime","Date and time of the collection event","NA","dateTime",NA
"2677",1847,"sampleTiming","Timing of the sampling event with regard to the field season","NA","string",NA
"2678",1848,"numVialsSampleID","Number of vials associated with a sampleID","number","unsigned integer",NA
"2679",1849,"fanStatus","Indicator of the status of the trap fan at the time of sample collection","NA","string",NA
"2680",1850,"catchCupStatus","Indicator of the status of the trap catch cup at the time of sample collection","NA","string",NA
"2681",1851,"dryIceStatus","Dry ice status at the time of sample collection","NA","string",NA
"2682",1852,"sampleCompromised","Indicator of compromised sample integrity; 'other' requires further specification in remarks","NA","string",NA
"2683",1853,"receivedDate","Date a sample was received","NA","dateTime",NA
"2684",1854,"sortDate","Date sample was sorted","NA","dateTime",NA
"2685",1855,"totalWeight","Weight of entire sample","gram","real",NA
"2686",1856,"subsampleWeight","Weight of subsample","gram","real",NA
"2687",1857,"bycatchWeight","Weight of bycatch","gram","real",NA
"2688",1858,"sortedBy","An identifier for the technician who sorted the sample","NA","string",NA
"2689",1859,"testingID","Identifier for the group of specimens for testing","NA","string",NA
"2690",1860,"individualIDList","List of individualIDs","NA","string",NA
"2691",1861,"identificationRemarks","Comments or notes about the identification","NA","string",NA
"2692",1862,"testingVialID","Identifier for the vial containing specimens for testing (e.g., pathogen testing, chemical analysis, etc.)","NA","string","DWC_v2013-05-25:materialSampleID [http://rs.tdwg.org/dwc/terms/history/index.htm#materialSampleID-2013-05-25]"
"2693",1863,"poolSize","Number of individuals in the pathogen testing pool","number","unsigned integer",NA
"2694",1864,"archiveVialIDList","Identifier(s) for the vial(s) containing specimens for archive","NA","string",NA
"2695",1865,"archivedCount","Number of individuals in the archive vial","number","unsigned integer",NA
"2696",1866,"archiveMedium","Method of preservation for the sample or specimen","NA","string",NA
"2697",1867,"deprecatedVialID","Identifier on vial label, if different from standard ID","NA","string","DWC_v2009-04-24:eventID [http://rs.tdwg.org/dwc/terms/history/index.htm#eventID-2009-04-24]"
"2698",1868,"testedDate","Date test was conducted","NA","dateTime",NA
"2699",1869,"senderID","Identifier for the facility or technician sending the sample or specimen","NA","string",NA
"2700",1870,"testProtocolVersion","The protocol version used to test the sample","NA","string",NA
"2701",1871,"testMethod","Method used to conduct test","NA","string",NA
"2702",1872,"testResult","Result of the test","NA","string",NA
"2703",1873,"testPathogenName","The name of the pathogen","NA","string",NA
"2704",1874,"testNumber","Test number in a sequence of tests","NA","unsigned integer",NA
"2705",1875,"finalResult","Whether or not this is the conclusive test result for this sample","NA","string",NA
"2706",1876,"locus","Name of genetic marker sequenced","NA","string",NA
"2707",1877,"percentIdentity","Percent match between sample and reference sequence","percent","unsigned integer",NA
"2708",1878,"sequenceDatabase","Name of database where sequence is stored","NA","string",NA
"2709",1879,"sequenceDatabaseID","Identifier for sample in sequence database","NA","string",NA
"2710",1880,"extractDepleted","Whether or not sample extract is depleted","NA","string",NA
"2711",1881,"testedBy","An identifier for the technician who tested the sample","NA","string",NA
"2712",1882,"pdaDecimalLatitude","The geographic latitude (in decimal degrees, WGS84) of the geographic center of the reference area as recorded by the PDA in the field","decimalDegree","real",NA
"2713",1883,"pdaDecimalLongitude","The geographic longitude (in decimal degrees, WGS84) of the geographic center of the reference area as recorded by the PDA in the field","decimalDegree","real",NA
